{
  "$schema": "https://github.com/glzr-io/zebar/raw/v2.7.0/resources/widget-schema.json",
  "htmlPath": "./dist/index.html",
  "zOrder": "normal",
  "shownInTaskbar": false,
  "focused": false,
  "resizable": false,
  "transparent": false,
  "privileges": {
    "shellCommands": [
      {
        "program": "echo",
        "argsRegex": ".*"
      },
      {
        "program": "chrome",
        "argsRegex": ".*"
      },
      {
        "program": "git",
        "argsRegex": ".*"
      },
      {
        "program": "cmd",
        "argsRegex": ".*"
      },
      {
        "program": "C:\\Program Files\\Google\\Chrome\\Application\\chrome.exe",
        "argsRegex": ".*"
      },
      {
        "program": "powershell",
        "argsRegex": ".*"
      },
      {
        "program": "powershellaa",
        "argsRegex": ".*"
      }
    ]
  },
  "presets": [
    {
      "name": "default",
      "anchor": "top_left",
      "offsetX": "0px",
      "offsetY": "0px",
      "width": "100%",
      "height": "40px",
      "monitorSelection": {
        "type": "all"
      },
      "dockToEdge": {
        "enabled": false,
        "edge": null,
        "windowMargin": "0px"
      }
    }
  ]
}
